{
  "schema_version": 1,
  "mode": "paper_only_report",
  "generated_at": "2026-06-18T07:00:00Z",
  "run_config": {
    "run_id": "20260618T064500Z",
    "timeframe": "1m",
    "static_allowlist": [
      {
        "pair_id": "PF_DOGEUSD__PF_PEPEUSD",
        "selected_variant": "ROBUST_Z"
      }
    ],
    "hold_window_bars": 5,
    "max_runtime_seconds": 86400,
    "max_observe_candidate_age_seconds": 120
  },
  "scope": {
    "timeframe": "1m",
    "position_identity": [
      "paper_position_id",
      "pair_id",
      "timeframe",
      "selected_variant",
      "direction"
    ],
    "run_started_at": "2026-06-18T06:45:00Z",
    "run_ended_at": "2026-06-18T06:50:15Z"
  },
  "source_counts": {
    "decision_records": 2,
    "position_records": 2
  },
  "summary": {
    "decision_records": 2,
    "entry_opened_decisions": 1,
    "exit_completed_decisions": 1,
    "exit_deferred_decisions": 0,
    "blocked_decisions": 0,
    "block_breakdown": {},
    "unique_positions": 1,
    "open_positions": 0,
    "closed_positions": 1,
    "profitable_closed_positions": 1,
    "sum_realized_net_bps": 7.25,
    "avg_realized_net_bps": 7.25
  },
  "by_pair_variant": [
    {
      "pair_id": "PF_DOGEUSD__PF_PEPEUSD",
      "timeframe": "1m",
      "selected_variant": "ROBUST_Z",
      "direction": "SHORT_SPREAD",
      "decision_records": 2,
      "entry_opened_decisions": 1,
      "exit_completed_decisions": 1,
      "exit_deferred_decisions": 0,
      "blocked_decisions": 0,
      "open_positions": 0,
      "closed_positions": 1,
      "profitable_closed_positions": 1,
      "sum_realized_net_bps": 7.25,
      "avg_realized_net_bps": 7.25
    }
  ],
  "open_positions": [],
  "closed_positions": [
    {
      "paper_position_id": "paper-position:v1:1m:PF_DOGEUSD__PF_PEPEUSD:ROBUST_Z:SHORT_SPREAD:2026-06-18T06:45:00Z",
      "pair_id": "PF_DOGEUSD__PF_PEPEUSD",
      "timeframe": "1m",
      "selected_variant": "ROBUST_Z",
      "direction": "SHORT_SPREAD",
      "status": "CLOSED",
      "entry_observed_at": "2026-06-18T06:45:00Z",
      "exit_eligible_at": "2026-06-18T06:50:00Z",
      "exit_observed_at": "2026-06-18T06:50:15Z",
      "exit_source_type": "paper_trade_outcome",
      "realized_net_bps": 7.25
    }
  ],
  "methodology": {
    "latest_position_state": "Position state is derived from the latest append-only record per paper_position_id.",
    "pnl_definition": "Realized net bps is summed from latest CLOSED paper positions only.",
    "execution_caveat": "This report is offline paper simulation evidence. It is not live PnL, not a fill audit, and not permission to enable live automation."
  }
}
